"occupation_id","evidence_id","employer_name","job_title","source_url","source_kind","task_statement","task_family_id","task_type","importance","frequency","review_status","source_confidence","notes"
"occ_27_3031_00","jd_pr_04","VeSync","Senior Public Relations Manager","https://jobs.lever.co/vesync/17ebce14-8878-45c3-9a5b-2c11fd35a664","public_job_posting","Coordinate with product, legal, executive, and marketing teams to deliver campaigns, launches, and external response plans coherently.","cluster_coordination","Core","0.78","0.56","reviewed_for_gap_fill","0.80","reviewed_public_job_posting|review_batch=fifth_tranche_2026_03|source_refs=pr_01|pr_03|pr_04"
"occ_27_3041_00","jd_ed_01","Future of Life","Editor","https://jobs.lever.co/futureof-life/c7e0c1ee-5aaa-473e-9d18-ba316b6f9d81","public_job_posting","Source, commission, and shape contributed pieces or story packages so strong ideas become publishable editorial products.","cluster_coordination","Core","0.80","0.54","reviewed_for_gap_fill","0.80","reviewed_public_job_posting|review_batch=fifth_tranche_2026_03|source_refs=ed_01|ed_02|ed_03"
"occ_27_3041_00","jd_ed_02","The Free Press","Senior Editor","https://api.lever.co/v0/postings/thefp/8841a5dd-f92f-4b50-bb4c-e7d1c91d6aa4?mode=json","public_job_posting","Provide structural, line, and copy edits that improve clarity, argument, tone, and factual rigor while maintaining editorial standards.","cluster_qa_review","Core","0.82","0.58","reviewed_for_gap_fill","0.81","reviewed_public_job_posting|review_batch=fifth_tranche_2026_03|source_refs=ed_01|ed_02|ed_04"
"occ_27_3041_00","jd_ed_03","AFAR","Senior Editor, Editorial","https://jobs.lever.co/AfarMedia/19c9e3ab-8aff-48d2-8588-4c18b373fc16","public_job_posting","Manage editorial calendars, assignment flow, and package prioritization across multiple stories, contributors, and deadlines.","cluster_oversight_strategy","Core","0.80","0.52","reviewed_for_gap_fill","0.80","reviewed_public_job_posting|review_batch=fifth_tranche_2026_03|source_refs=ed_01|ed_03|ed_04"
"occ_27_3041_00","jd_ed_04","Jobgether","Managing Editor, Learning Solutions","https://jobs.lever.co/jobgether/68e1cac9-bd63-43c4-a2db-a1a04e4c7954","public_job_posting","Collaborate with design, audience, production, and leadership partners to package content for publication impact and quality control.","cluster_decision_support","Core","0.78","0.50","reviewed_for_gap_fill","0.80","reviewed_public_job_posting|review_batch=fifth_tranche_2026_03|source_refs=ed_02|ed_03|ed_04"
"occ_43_9111_00","jd_st_01","Instacart","Data Analyst, Legal Compliance","https://boards.greenhouse.io/instacart/jobs/7536747","public_job_posting","Collect, clean, organize, and maintain datasets and recurring reporting pipelines that support operational or compliance visibility.","cluster_documentation","Core","0.82","0.64","reviewed_for_gap_fill","0.81","reviewed_public_job_posting|review_batch=fifth_tranche_2026_03|source_refs=st_01|st_02|st_03"
"occ_43_9111_00","jd_st_02","Aurora","Safety Data Analyst","https://boards.greenhouse.io/aurorainnovation/jobs/8296980002","public_job_posting","Build dashboards, KPI reports, and recurring summaries that surface trends and performance signals for operational teams.","cluster_analysis","Core","0.82","0.62","reviewed_for_gap_fill","0.81","reviewed_public_job_posting|review_batch=fifth_tranche_2026_03|source_refs=st_01|st_02|st_04"
"occ_43_9111_00","jd_st_03","Samsara","Senior Customer Success Quality Analyst","https://boards.greenhouse.io/samsara/jobs/7373807","public_job_posting","Support workflow tooling, quality checks, and monitoring systems that keep data-driven processes accurate and usable.","cluster_qa_review","Core","0.80","0.60","reviewed_for_gap_fill","0.80","reviewed_public_job_posting|review_batch=fifth_tranche_2026_03|source_refs=st_01|st_03|st_04"
"occ_43_9111_00","jd_st_04","Figma","People Analyst","https://boards.greenhouse.io/figma/jobs/5737300004","public_job_posting","Partner with analysts and business stakeholders to investigate anomalies, support forecasting, and explain data patterns in decisions.","cluster_decision_support","Core","0.78","0.54","reviewed_for_gap_fill","0.80","reviewed_public_job_posting|review_batch=fifth_tranche_2026_03|source_refs=st_02|st_03|st_04"
"occ_43_3031_00","jd_bk_01","Empire State Realty Trust","Accounts Payable Specialist","https://jobs.lever.co/esrtreit/b9ee8574-ae7f-4f2f-8ddc-5fa50dde9c72","public_job_posting","Process, code, and route invoices, expense items, and other payables accurately through ERP and approval workflows.","cluster_documentation","Core","0.84","0.68","reviewed_for_gap_fill","0.81","reviewed_public_job_posting|review_batch=routine_review_2026_03|source_refs=bk_01|bk_02|bk_03"
"occ_43_3031_00","jd_bk_02","Solar Landscape","Accounts Payable Specialist","https://jobs.lever.co/solarlandscape/09e82e2b-f8e7-4225-9591-0cfe16b56e1e","public_job_posting","Reconcile vendor accounts, statements, and ledger balances and resolve discrepancies against purchase orders and approvals.","cluster_qa_review","Core","0.82","0.62","reviewed_for_gap_fill","0.81","reviewed_public_job_posting|review_batch=routine_review_2026_03|source_refs=bk_01|bk_02|bk_04"
"occ_43_3031_00","jd_bk_03","Promethean","Specialist II, Accounts Payable","https://jobs.lever.co/prometheanworld/f3e69ad6-19ca-494d-bacd-388094bf75a5","public_job_posting","Prepare payment runs, employee expense audits, and month-end or close-support tasks under internal-control requirements.","cluster_coordination","Core","0.80","0.58","reviewed_for_gap_fill","0.80","reviewed_public_job_posting|review_batch=routine_review_2026_03|source_refs=bk_02|bk_03|bk_04"
"occ_43_3031_00","jd_bk_04","Gridware","Payroll & AP Operations Specialist","https://jobs.lever.co/gridware/f05d7d94-0525-44d1-aa1e-fa105ca32cd0","public_job_posting","Coordinate with vendors, finance teams, and internal stakeholders to maintain AP records, resolve exceptions, and keep finance operations current.","cluster_coordination","Core","0.78","0.56","reviewed_for_gap_fill","0.80","reviewed_public_job_posting|review_batch=routine_review_2026_03|source_refs=bk_01|bk_03|bk_04"
"occ_43_9061_00","jd_oc_01","August Bioservices","Office Coordinator","https://jobs.lever.co/AugustBioservices/0cd9771b-47f8-444f-9dae-a17e1226df74","public_job_posting","Manage front-desk flow, greet visitors, route calls or messages, and maintain a professional first point of contact for the office.","cluster_client_interaction","Core","0.82","0.70","reviewed_for_gap_fill","0.80","reviewed_public_job_posting|review_batch=routine_review_2026_03|source_refs=oc_01|oc_02|oc_03"
"occ_43_9061_00","jd_oc_02","Valinor","Office Admin","https://jobs.lever.co/valinor/80aabcd7-095d-4e48-94ca-5cdae4a42e12","public_job_posting","Coordinate office vendors, facilities issues, supply requests, and day-to-day workplace operations so routine needs are handled quickly.","cluster_coordination","Core","0.80","0.66","reviewed_for_gap_fill","0.80","reviewed_public_job_posting|review_batch=routine_review_2026_03|source_refs=oc_01|oc_02|oc_04"
"occ_43_9061_00","jd_oc_03","Coates Group","Office Coordinator","https://jobs.lever.co/coatesgroup/73e5a92b-3811-467c-8da7-94c806933ac9","public_job_posting","Support onboarding, office events, internal announcements, and other routine logistics that keep shared office workflows running.","cluster_coordination","Core","0.78","0.62","reviewed_for_gap_fill","0.79","reviewed_public_job_posting|review_batch=routine_review_2026_03|source_refs=oc_01|oc_02|oc_03"
"occ_43_9061_00","jd_oc_04","Centuria","Administrative Assistant","https://jobs.lever.co/centuria/450e6928-3dce-4b2a-923d-14ac9ee70c90","public_job_posting","Maintain routine records, reports, time-and-attendance support, and general clerical requests across office teams.","cluster_documentation","Core","0.78","0.68","reviewed_for_gap_fill","0.79","reviewed_public_job_posting|review_batch=routine_review_2026_03|source_refs=oc_02|oc_03|oc_04"
"occ_43_6014_00","jd_adm_01","HCVT","Administrative Assistant","https://jobs.lever.co/hcvt/37f4cd45-5594-4c7e-b46f-ea11306c3d2c","public_job_posting","Manage calendars, meetings, travel, and expense reporting for supported leaders while keeping routine administrative work moving.","cluster_coordination","Core","0.82","0.66","reviewed_for_gap_fill","0.80","reviewed_public_job_posting|review_batch=routine_review_2026_03|source_refs=adm_01|adm_02|adm_03"
"occ_43_6014_00","jd_adm_02","Stand Together","Senior Administrative Assistant, Strategic Partnerships","https://jobs.lever.co/standtogether/8ab01976-3946-4e86-97c3-f87ff9ccf172","public_job_posting","Prepare correspondence, agendas, presentations, and meeting materials and keep confidential administrative records organized.","cluster_documentation","Core","0.80","0.60","reviewed_for_gap_fill","0.80","reviewed_public_job_posting|review_batch=routine_review_2026_03|source_refs=adm_01|adm_02|adm_04"
"occ_43_6014_00","jd_adm_03","Lessen","Senior Administrative Assistant","https://jobs.lever.co/lessen/340d28dc-5c56-422b-ab3c-646b680f9540","public_job_posting","Track follow-ups, deadlines, and internal workflow requests across teams so managers and staff stay aligned on routine operations.","cluster_coordination","Core","0.78","0.58","reviewed_for_gap_fill","0.79","reviewed_public_job_posting|review_batch=routine_review_2026_03|source_refs=adm_02|adm_03|adm_04"
"occ_43_6014_00","jd_adm_04","SAIT","Administrative Assistant","https://jobs.lever.co/sait/893f4b4c-749e-4235-8e9e-612a985c3a99","public_job_posting","Handle minutes, confidential records, service requests, and other recurring support tasks with discretion and procedural consistency.","cluster_qa_review","Core","0.78","0.56","reviewed_for_gap_fill","0.79","reviewed_public_job_posting|review_batch=routine_review_2026_03|source_refs=adm_01|adm_03|adm_04"
"occ_43_6011_00","jd_ea_01","Sonatype","Executive/Administrative Assistant","https://jobs.lever.co/sonatype/fd7f1d78-42fa-4330-98d3-e0fb6c587baf","public_job_posting","Act as a gatekeeper and scheduling partner for executives by sequencing calendars, communications, travel, and changing priorities.","cluster_relationship_management","Core","0.82","0.64","reviewed_for_gap_fill","0.80","reviewed_public_job_posting|review_batch=routine_review_2026_03|source_refs=ea_01|ea_02|ea_03"
"occ_43_6011_00","jd_ea_02","KIND","Executive Administrative Assistant","https://jobs.lever.co/supportkind/686ff7d3-4771-4ffc-bb24-4d484370748a","public_job_posting","Prepare executive-office materials, event logistics, expense support, and follow-up systems for leadership and external stakeholders.","cluster_documentation","Core","0.80","0.60","reviewed_for_gap_fill","0.80","reviewed_public_job_posting|review_batch=routine_review_2026_03|source_refs=ea_01|ea_02|ea_04"
"occ_43_6011_00","jd_ea_03","e.l.f. Beauty","Executive Assistant","https://jobs.lever.co/elfbeauty/3ba0b07b-a0a4-40cd-b617-3575c3444f08","public_job_posting","Coordinate board, leadership, and cross-functional interactions while handling highly sensitive information with discretion.","cluster_client_interaction","Core","0.80","0.58","reviewed_for_gap_fill","0.80","reviewed_public_job_posting|review_batch=routine_review_2026_03|source_refs=ea_01|ea_03|ea_04"
"occ_43_6011_00","jd_ea_04","Filevine","Executive Assistant to the CMO","https://jobs.lever.co/filevine/aef2dd52-210b-46f9-95d3-b247cd4a0131","public_job_posting","Track action items, align departments, and extend executive decision cadence through project coordination and operational follow-through.","cluster_oversight_strategy","Core","0.78","0.56","reviewed_for_gap_fill","0.80","reviewed_public_job_posting|review_batch=routine_review_2026_03|source_refs=ea_02|ea_03|ea_04"
